{
  "schemaVersion": 1,
  "status": "received",
  "receiptId": "594bcc69-8f09-4dce-a98a-bba5de7ef0c2",
  "runId": "2C11D24C-86DA-4AE9-9BE4-D67308E27389",
  "manifestSha256": "3e338f7284385a87c96d2f0e97eeabf9c5dc1d3b932892a58e9101a51064b439",
  "artifactSha256": [
    "7f2ef803eb18c972385ea5f830fb59e95f40ae0be34de1dceb275b7da787f607",
    "881cbdace3db209aab4f8cbb5d183ec8f6a71662ff6f5d7e5c22c7fecca858b3"
  ],
  "receivedAt": "2026-08-10T22:31:00Z",
  "serverEnvironment": "development",
  "ingestVersion": "vista-package-ingest-v1",
  "analysisStatus": "notRequested"
}
